[
  {
    "id": "bio_immunity_antibody_12",
    "subject": "生物",
    "stage": [
      "h"
    ],
    "topic": "特异性免疫",
    "name": "抗体能消灭细胞内的病毒",
    "description": "认为抗体无所不能，甚至可以穿透细胞膜，进入已经被感染的宿主细胞内部去杀死病毒。",
    "typical_error": "病毒躲在我的细胞里，不过没关系，我打针产生的抗体会钻进细胞里把它干掉。",
    "cause": "混淆了体液免疫（抗体发挥作用）和细胞免疫（效应T细胞裂解靶细胞）的功能分工。"
  },
  {
    "id": "bio_hormone_enzyme_13",
    "subject": "生物",
    "stage": [
      "h"
    ],
    "topic": "动物激素调节",
    "name": "激素等同于酶",
    "description": "把激素和酶的作用混为一谈，认为激素也是用来催化体内的化学反应的。",
    "typical_error": "胰岛素这种激素就是催化血糖变成糖原的酶。",
    "cause": "两者都具有微量和高效的特点，且都能调节生命活动，导致学生在功能机制（信息传递 vs 催化剂）上产生混淆。"
  },
  {
    "id": "bio_photosynthesis_dark_15",
    "subject": "生物",
    "stage": [
      "h"
    ],
    "topic": "光合作用",
    "name": "暗反应只在暗处进行",
    "description": "被“暗反应”这个名字误导，认为光合作用的第二阶段只能在没有光照的晚上或黑暗中进行。",
    "typical_error": "植物白天进行光反应吸收光能，等到了晚上没光了才开始进行暗反应合成葡萄糖。",
    "cause": "名词术语字面意义的强烈误导（暗反应实则指不需要光直接参与，但需要光反应提供的 ATP 和 NADPH）。"
  },
  {
    "id": "bio_gene_trait_16",
    "subject": "生物",
    "stage": [
      "h"
    ],
    "topic": "基因对性状的控制",
    "name": "一个基因只决定一个性状",
    "description": "认为基因和性状是一一对应的完美映射，忽略了“一因多效”和“多因一效”的复杂关系。",
    "typical_error": "人的身高肯定是由唯一的一个“身高基因”控制的。",
    "cause": "孟德尔经典的单基因遗传定律（如豌豆的圆粒和皱粒）留下的刻板印象。"
  },
  {
    "id": "bio_evolution_individual_24",
    "subject": "生物",
    "stage": [
      "h"
    ],
    "topic": "现代生物进化理论",
    "name": "个体是进化的基本单位",
    "description": "认为进化是单个生物体在其一生中逐渐发生改变以适应环境的过程。",
    "typical_error": "这只飞蛾为了不被鸟吃掉，通过一生的努力把自己的颜色从白色进化成了黑色。",
    "cause": "拉马克学说的主观残存，未能转变为以种群基因频率改变为核心的现代进化论视角。"
  },
  {
    "id": "bio_ecology_stability_25",
    "subject": "生物",
    "stage": [
      "h"
    ],
    "topic": "生态系统稳定性",
    "name": "生物种类多恢复力就强",
    "description": "认为热带雨林等复杂生态系统既然强大，那么不管是抵抗力还是遭到破坏后的恢复力，都肯定是最强的。",
    "typical_error": "热带雨林被砍伐烧毁后，它恢复原来样貌的速度肯定比北极苔原快，因为它物种丰富。",
    "cause": "混淆了抵抗力稳定性（复杂生态系统强）和恢复力稳定性（往往呈负相关），以偏概全地理解“稳定性”。"
  },
  {
    "id": "bio_enzyme_temperature_26",
    "subject": "生物",
    "stage": [
      "h"
    ],
    "topic": "酶的特性",
    "name": "低温也会使酶变性失活",
    "description": "基于“极端温度对酶不好”的对称性想象，认为温度太低也会破坏酶的空间结构导致其永久变性失活。",
    "typical_error": "把肉冻在冰箱里，里面的酶因为太冷变性死掉了，所以肉不会坏。",
    "cause": "未能准确区分高温（破坏肽链空间结构）和低温（仅仅是抑制活性但不破坏结构）对蛋白质的不同物理化学影响。"
  },
  {
    "id": "bio_atp_storage_27",
    "subject": "生物",
    "stage": [
      "h"
    ],
    "topic": "ATP",
    "name": "ATP 是主要的储能物质",
    "description": "知道 ATP 是能量通货，就误以为细胞体内会大量囤积 ATP 以备不时之需。",
    "typical_error": "人吃饱饭后，多余的能量都被合成为海量的 ATP 储存在肚子里了。",
    "cause": "将“通货（现金）”与“储蓄（存款，如脂肪、糖原）”混为一谈，不了解 ATP 与 ADP 高速转化的动态平衡特征。"
  },
  {
    "id": "bio_genetics_sex_28",
    "subject": "生物",
    "stage": [
      "h"
    ],
    "topic": "伴性遗传",
    "name": "伴X隐性母亲患病女儿必病",
    "description": "在分析色盲等伴 X 隐性遗传时，记住了“母病子必病”，错误类推认为母亲患病女儿也一定患病。",
    "typical_error": "母亲是红绿色盲，那她生下来的所有孩子，不管是男是女，绝对都是色盲。",
    "cause": "口诀记忆的泛化和逻辑推演的缺失，忽略了女儿的另一条 X 染色体来自父亲，父亲正常则女儿为携带者。"
  },
  {
    "id": "bio_evolution_teleology_02_alt_high",
    "subject": "生物",
    "stage": [
      "h"
    ],
    "topic": "生物的进化",
    "name": "用进废退是现代进化论的核心",
    "description": "认为生物的器官越用越发达，并且能遗传给后代。",
    "typical_error": "长颈鹿的脖子是因为想吃高处的树叶伸长的。",
    "cause": "将拉马克的观点与达尔文自然选择学说混淆。"
  },
  {
    "id": "bio_disease_genetic_05_alt_high",
    "subject": "生物",
    "stage": [
      "h"
    ],
    "topic": "人类遗传病",
    "name": "家族性疾病一定是由基因突变引起",
    "description": "认为只要是家族里多人患的病就是遗传病。",
    "typical_error": "他们家都得了夜盲症，肯定是遗传的。",
    "cause": "忽视了共同的生活环境或饮食习惯的影响。"
  },
  {
    "id": "bio_genetics_dominant_06_alt_high",
    "subject": "生物",
    "stage": [
      "h"
    ],
    "topic": "基因的显性和隐性",
    "name": "显性性状在人群中占比一定更高",
    "description": "认为显性基因控制的性状在人群中出现的频率一定大于隐性性状。",
    "typical_error": "双眼皮是显性，所以世界上双眼皮的人肯定比单眼皮多。",
    "cause": "将基因显隐性与基因频率混淆。"
  },
  {
    "id": "bio_ecology_energy_07_alt_high",
    "subject": "生物",
    "stage": [
      "h"
    ],
    "topic": "生态系统的能量流动",
    "name": "能量在营养级间传递效率可以达到100%",
    "description": "认为上一营养级的能量可以完全传递给下一营养级。",
    "typical_error": "草的能量可以完全被羊吸收转化。",
    "cause": "忽略了呼吸作用消耗和未被利用的能量。"
  },
  {
    "id": "bio_nervous_reflex_09_alt_high",
    "subject": "生物",
    "stage": [
      "h"
    ],
    "topic": "神经调节",
    "name": "条件反射是天生的",
    "description": "认为条件反射和非条件反射一样，都是与生俱来的。",
    "typical_error": "婴儿一生下来听到铃声就会流口水。",
    "cause": "对条件反射后天学习形成的本质理解不透彻。"
  },
  {
    "id": "bio_blood_type_11_alt_high",
    "subject": "生物",
    "stage": [
      "h"
    ],
    "topic": "孟德尔遗传规律",
    "name": "O型血的父母能生出A型血的孩子",
    "description": "对ABO血型遗传规律存在错误推断。",
    "typical_error": "因为A型血是显性，所以可能突变出来。",
    "cause": "不熟悉复等位基因的遗传定律。"
  },
  {
    "id": "bio_mutation_harmful_17_alt_high",
    "subject": "生物",
    "stage": [
      "h"
    ],
    "topic": "基因突变",
    "name": "基因突变都会引起性状改变",
    "description": "认为只要发生基因突变，生物的表现型就一定会改变。",
    "typical_error": "DNA序列变了，长相肯定就不一样了。",
    "cause": "忽略了密码子的简并性和隐性突变。"
  },
  {
    "id": "bio_chromosome_number_22_alt_high",
    "subject": "生物",
    "stage": [
      "h"
    ],
    "topic": "染色体",
    "name": "体型越大的生物染色体越多",
    "description": "认为生物的大小或高等程度与染色体数量成正比。",
    "typical_error": "大象比人高级/大，所以大象的染色体肯定比人多得多。",
    "cause": "对染色体只是遗传物质的载体缺乏本质理解。"
  }
]