[
  {
    "id": "politics_eco_01",
    "subject": "politics",
    "stage": [
      "h"
    ],
    "topic": "商品的基本属性",
    "name": "使用价值决定价值",
    "description": "认为商品的质量越好（使用价值大），其价值量就越大，价格就越高。",
    "typical_error": "这件衣服穿起来特别舒服，质量特别好，所以它就应该卖得贵。",
    "cause": "混淆了使用价值和价值的概念，没有认识到价值量是由生产该商品的社会必要劳动时间决定的，质量好只是实现价值的条件。"
  },
  {
    "id": "politics_eco_02",
    "subject": "politics",
    "stage": [
      "h"
    ],
    "topic": "宏观调控与市场调节",
    "name": "宏观调控起决定性作用",
    "description": "认为在社会主义市场经济中，国家的宏观调控在资源配置中起决定性作用。",
    "typical_error": "我国是社会主义国家，所以什么东西生产多少、卖多少钱都应该由国家说了算。",
    "cause": "对我国经济体制的性质认识不清。市场经济中，市场在资源配置中起决定性作用，宏观调控是辅助的弥补手段。"
  },
  {
    "id": "politics_pol_01",
    "subject": "politics",
    "stage": [
      "h"
    ],
    "topic": "公民的权利",
    "name": "公民享有直接管理国家的权力",
    "description": "认为作为国家的主人，普通公民可以直接参与国家事务的具体管理和决策。",
    "typical_error": "我是公民，我有权直接决定我们市今年的财政预算怎么花。",
    "cause": "没有厘清我国的政体。我国是代议制国家，公民通过选举人大代表组成国家权力机关来间接行使国家权力，而不是直接管理。"
  },
  {
    "id": "politics_pol_02",
    "subject": "politics",
    "stage": [
      "h"
    ],
    "topic": "人大与人大代表的职权",
    "name": "混淆决定权与质询权",
    "description": "将人民代表大会（集体）的决定权与人大代表（个人）的质询权等混为一谈。",
    "typical_error": "全国人大代表行使了决定权，通过了某项法律。",
    "cause": "概念不清。决定权、立法权等是人民代表大会的职权；审议、表决、提案、质询是人大代表个人的权利。"
  },
  {
    "id": "politics_pol_03",
    "subject": "politics",
    "stage": [
      "h"
    ],
    "topic": "政府的宗旨",
    "name": "政府包办一切事务",
    "description": "认为政府是万能的，应当承担社会生活中的所有管理和服务职能。",
    "typical_error": "小区里的狗叫声太吵了，政府应该马上派人来把狗抓走，不然就是不作为。",
    "cause": "夸大了政府的职能。政府职能是有限的，应当坚持“法无授权不可为”，不能干预本应由基层群众自治组织或市场解决的问题。"
  },
  {
    "id": "politics_pol_04",
    "subject": "politics",
    "stage": [
      "h"
    ],
    "topic": "中国共产党",
    "name": "党代替政府行使行政职能",
    "description": "认为党既然是领导核心，就可以直接下发行政指令、代替政府行使国家职能。",
    "typical_error": "市委今天下发了交通违章处罚新规，从明天起对违停罚款翻倍。",
    "cause": "没有区分党的领导和国家政权机关的职能。党不直接行使国家机关的具体行政管理职能，党主要是进行政治、思想、组织领导。"
  },
  {
    "id": "politics_cul_01",
    "subject": "politics",
    "stage": [
      "h"
    ],
    "topic": "文化对人的影响",
    "name": "文化对人的影响是强制的",
    "description": "认为身处某种文化环境中，人就必然会被强行改变，没有自主选择的余地。",
    "typical_error": "只要把他送到国外的学校去，不管他愿不愿意，他的思想观念马上就会变成西方的那一套。",
    "cause": "忽视了人具有主观能动性。文化对人的影响是潜移默化的，但人们接受文化熏陶的过程是自觉学习、主动接受的过程。"
  },
  {
    "id": "politics_phil_01",
    "subject": "politics",
    "stage": [
      "h"
    ],
    "topic": "意识的能动作用",
    "name": "意识直接改造客观世界",
    "description": "认为人的意识、精神力量可以直接引起客观物质事物的变化。",
    "typical_error": "只要全班同学都在心里默念‘一定要考好’，我们的平均分就一定会提高。",
    "cause": "夸大了意识的作用，陷入了唯心主义。意识必须通过指导人们的实践活动（物质性的活动），才能将蓝图变为现实。"
  },
  {
    "id": "politics_phil_02",
    "subject": "politics",
    "stage": [
      "h"
    ],
    "topic": "联系的客观性",
    "name": "人可以主观创造联系",
    "description": "认为人类可以根据自己的主观意愿，随意地创造出事物之间原本不存在的联系。",
    "typical_error": "数字‘8’就是能带来发财的好运，这是我们赋予它的联系。",
    "cause": "违背了联系的客观性。联系是事物本身固有的，不以人的意志为转移；人只能根据事物固有的联系，改变事物的状态，建立新的具体联系。"
  },
  {
    "id": "politics_phil_03",
    "subject": "politics",
    "stage": [
      "h"
    ],
    "topic": "量变与质变",
    "name": "量变必然导致质变",
    "description": "认为只要事物的发展有了量的积累，就一定会发生质的飞跃。",
    "typical_error": "只要我每天背一个单词，总有一天我会成为英语同声传译专家。",
    "cause": "忽视了质变的前提。量变只有达到一定程度（突破了‘度’），才会引起质变，单纯的微小量变如果没有积累到节点是不会发生质变的。"
  },
  {
    "id": "politics_phil_04",
    "subject": "politics",
    "stage": [
      "h"
    ],
    "topic": "矛盾的普遍性与特殊性",
    "name": "普遍性包含特殊性",
    "description": "认为矛盾的普遍性（共性）范围更大，包含了特殊性（个性）的所有内容。",
    "typical_error": "‘水果’这个概念包含了苹果的脆、香蕉的软等所有特点。",
    "cause": "颠倒了共性与个性的关系。普遍性寓于特殊性之中，是通过特殊性表现出来的；特殊性包含着普遍性，但又有着比普遍性更丰富的个别属性。"
  },
  {
    "id": "politics_phil_05",
    "subject": "politics",
    "stage": [
      "h"
    ],
    "topic": "人民群众的历史地位",
    "name": "杰出人物决定历史",
    "description": "认为社会历史的发展进程是由少数杰出英雄人物的意志和行动决定的。",
    "typical_error": "如果没有拿破仑，法国大革命就根本不会发生，历史的走向完全取决于英雄。",
    "cause": "陷入了历史唯心主义的英雄史观。历史唯物主义认为，人民群众才是历史的创造者，杰出人物只能加速或延缓历史进程，不能改变历史发展的基本趋势。"
  }
]