[
  {
    "id": "history_world_pol_01",
    "subject": "history",
    "stage": [
      "h"
    ],
    "topic": "英国君主立宪制",
    "name": "国王握有实权",
    "description": "将英国君主立宪制下的国王等同于封建专制时期的君主，认为其拥有实权。",
    "typical_error": "英国首相的决定如果不符合国王的心意，国王可以随时罢免首相并自己制定法律。",
    "cause": "未能理解《权利法案》后英国王权受到法律限制，国王逐渐处于“统而不治”的地位，实权在议会和内阁手中。"
  },
  {
    "id": "history_world_pol_02",
    "subject": "history",
    "stage": [
      "h"
    ],
    "topic": "雅典民主政治",
    "name": "全民的民主",
    "description": "认为古希腊雅典的民主是现代意义上所有居住在雅典的人都能享受的民主。",
    "typical_error": "在古代雅典，只要是住在雅典的成年人，无论是男女还是奴隶，都可以去公民大会投票。",
    "cause": "忽视了雅典民主政治的阶级局限性，它仅仅是本邦成年男性公民的民主，排除了妇女、奴隶和外邦人。"
  },
  {
    "id": "history_world_pol_03",
    "subject": "history",
    "stage": [
      "h"
    ],
    "topic": "冷战",
    "name": "仅指军事对抗",
    "description": "认为“冷战”仅仅是美国和苏联两国在军事上陈兵边境、互相对峙。",
    "typical_error": "冷战就是美苏两国军队拿着枪互相对着，但是不开枪，不涉及政治和经济。",
    "cause": "对“冷战”概念的内涵理解不全面，冷战是除直接武装交战之外的在政治、经济、军事、意识形态等各方面的全面对抗。"
  },
  {
    "id": "history_world_eco_01",
    "subject": "history",
    "stage": [
      "h"
    ],
    "topic": "经济全球化",
    "name": "仅对发达国家有利",
    "description": "认为经济全球化完全是发达国家的阴谋，对发展中国家百害而无一利。",
    "typical_error": "经济全球化就是西方国家剥削穷国，发展中国家加入全球化只会变得更穷。",
    "cause": "没有用辩证的观点看待全球化。全球化是一把双刃剑，由发达国家主导，但发展中国家也能从中获得资金、技术和市场机遇。"
  },
  {
    "id": "history_cn_culture_01",
    "subject": "history",
    "stage": [
      "h"
    ],
    "topic": "儒家思想发展",
    "name": "董仲舒新儒学等同先秦儒学",
    "description": "认为汉代董仲舒创立的新儒学体系和孔孟的先秦儒学在内容上完全一致。",
    "typical_error": "汉武帝罢黜百家、独尊儒术，尊崇的就是孔子提倡的完全原汁原味的早期儒家思想。",
    "cause": "没有认识到思想体系的时代演进。董仲舒糅合了道家、法家、阴阳五行家等思想，增加了“天人感应”“君权神授”等内容以适应大一统的需要。"
  },
  {
    "id": "history_world_pol_04",
    "subject": "history",
    "stage": [
      "h"
    ],
    "topic": "罗马法",
    "name": "混淆公民法与万民法",
    "description": "弄错公民法和万民法的适用范围和时间顺序。",
    "typical_error": "罗马帝国建立后，为了管理广大的疆域，开始对所有被征服地区的居民广泛适用公民法。",
    "cause": "知识点记忆混淆。公民法只适用于罗马共和国时期的罗马公民，随着帝国扩张才演变出适用于罗马统治范围内一切自由民的万民法。"
  },
  {
    "id": "history_world_pol_05",
    "subject": "history",
    "stage": [
      "h"
    ],
    "topic": "马克思主义的诞生",
    "name": "与巴黎公社挂钩",
    "description": "认为《共产党宣言》的发表标志着巴黎公社的建立，或巴黎公社标志着马克思主义的诞生。",
    "typical_error": "1848年《共产党宣言》的发表，直接导致了巴黎公社这一第一个社会主义国家的建立。",
    "cause": "历史事件时空错乱。1848年《共产党宣言》发表标志马克思主义诞生；1871年巴黎公社是无产阶级建立政权的第一次伟大尝试（且非社会主义国家）。"
  },
  {
    "id": "history_cn_eco_01",
    "subject": "history",
    "stage": [
      "h"
    ],
    "topic": "改革开放",
    "name": "经济特区等于特别行政区",
    "description": "将对外开放的“经济特区”（如深圳）与落实一国两制的“特别行政区”（如香港）混淆。",
    "typical_error": "深圳作为经济特区，和香港一样实行资本主义制度，享有高度自治权。",
    "cause": "对“特”的内涵理解错误。经济特区“特”在实行特殊的经济政策；特别行政区“特”在实行不同的社会制度（资本主义）。"
  },
  {
    "id": "history_world_eco_02",
    "subject": "history",
    "stage": [
      "h"
    ],
    "topic": "罗斯福新政",
    "name": "从根本上消除经济危机",
    "description": "认为罗斯福新政彻底解决了资本主义经济危机，以后再也不会发生危机了。",
    "typical_error": "罗斯福通过国家干预经济，完美地消除了资本主义社会的基本矛盾，从根本上杜绝了经济危机。",
    "cause": "夸大了新政的作用。新政只是缓解了危机，只要资本主义制度的基本矛盾（生产社会化与生产资料私人占有）存在，危机就无法根本消除。"
  },
  {
    "id": "history_world_pol_06",
    "subject": "history",
    "stage": [
      "h"
    ],
    "topic": "世界多极化",
    "name": "多极化格局已形成",
    "description": "认为目前世界已经处于确定的多极化格局之中。",
    "typical_error": "随着苏联解体和中国、欧盟的崛起，世界已经正式形成了多极化的政治格局。",
    "cause": "混淆了“趋势”与“定局”。目前世界格局处于“一超多强”的局面，多极化只是一种不断发展的发展趋势，尚未最终定型。"
  }
]