[
  {
    "id": "chi_reading_scenery_01",
    "subject": "语文",
    "stage": [
      "j_upper"
    ],
    "topic": "现代文阅读",
    "name": "混淆借景抒情与托物言志",
    "description": "在分析散文或诗歌的表达技巧时，无法区分景物描写是为了抒发情感（借景抒情）还是为了寄托某种精神品质（托物言志）。",
    "typical_error": "这首诗里写了高洁的菊花，作者是在借景抒情，表达自己像菊花一样的心情。",
    "cause": "对文学手法的概念只停留在背诵层面，未能深入理解“景”与“情”（情绪色彩）及“物”与“志”（精神人格）的对应关系。"
  },
  {
    "id": "chi_writing_topic_02",
    "subject": "语文",
    "stage": [
      "j_lower"
    ],
    "topic": "写作表达",
    "name": "立意生硬拔高",
    "description": "在写作记叙文时，为了追求思想深刻，在结尾强行抒发与前文内容不符或过于宏大的情感。",
    "typical_error": "（前面写帮妈妈洗碗）...通过这次洗碗，我深刻体会到了中华民族五千年的传统美德，我一定要报效祖国！",
    "cause": "受应试作文模板的负面影响，误以为“好作文”必须有宏大的家国情怀，缺乏对真情实感的体会和自然表达。"
  },
  {
    "id": "chi_classical_grammar_03",
    "subject": "语文",
    "stage": [
      "j_upper"
    ],
    "topic": "文言文阅读",
    "name": "文言句式死记硬背不看语境",
    "description": "遇到文言文特殊句式或词类活用时，只机械套用规律，不结合上下文语境进行翻译，导致译文不通顺或表意错误。",
    "typical_error": "看到“沛公军霸上”，因为背过名词作动词，就生硬地翻译成“沛公军队霸上”，而不懂翻译成“沛公驻军在霸上”。",
    "cause": "缺乏对古代汉语语言习惯的整体感知，将鲜活的文言文肢解为僵化的语法零件。"
  },
  {
    "id": "chi_vocabulary_emotion_04",
    "subject": "语文",
    "stage": [
      "j_lower"
    ],
    "topic": "词语运用",
    "name": "词语感彩误用",
    "description": "在使用成语或词语时，未能分辨其褒贬色彩，常常将贬义词当做褒义词或中性词使用。",
    "typical_error": "王老师为了我们的学习，每天都处心积虑地备课，真是太辛苦了。",
    "cause": "只记住了词语的表面意思（如处心积虑=费尽心思），缺乏在具体语境中体会词语感情倾向的语感训练。"
  },
  {
    "id": "chi_grammar_subject_05",
    "subject": "语文",
    "stage": [
      "j_upper"
    ],
    "topic": "病句辨析",
    "name": "找不准句子主干成分",
    "description": "在分析病句（尤其是成分残缺或搭配不当）时，被长修饰语迷惑，无法准确提取出主谓宾。",
    "typical_error": "看到“经过老师的教导，使我认识到了错误”，觉得句子读起来很顺，看不出缺少主语的问题。",
    "cause": "汉语母语者大多依靠语感而非严格的句法分析来理解句子，长期的意合口语习惯干扰了书面语的语法规范审查。"
  },
  {
    "id": "chi_poetry_imagery_06",
    "subject": "语文",
    "stage": [
      "j_upper"
    ],
    "topic": "古诗词鉴赏",
    "name": "诗歌意象简单标签化",
    "description": "认为某个意象永远只对应一种情感，忽略了诗人的独特境遇和具体的上下文语境。",
    "typical_error": "只要看到诗里写了“柳”，就认为全诗表达的绝对是离愁别绪的送别之情。",
    "cause": "诗歌鉴赏初级阶段过度依赖工具书式的“意象词典”，丧失了知人论世、涵咏文本的能力。"
  },
  {
    "id": "chi_argument_evidence_07",
    "subject": "语文",
    "stage": [
      "j_upper"
    ],
    "topic": "议论文写作",
    "name": "论点与论据脱节（以叙代议）",
    "description": "在写议论文时，提出论点后，只是讲了一个很长的故事（论据），缺乏对材料的剖析和与论点的逻辑推演。",
    "typical_error": "论点是“坚持就是胜利”，然后花了大半篇幅写司马迁受宫刑写史记的故事，最后加一句“所以我们要坚持”。",
    "cause": "文体意识薄弱，习惯了记叙文的写作模式，没有掌握“叙述材料—提炼共性—逻辑证明”的议论框架。"
  },
  {
    "id": "chi_classical_meaning_09",
    "subject": "语文",
    "stage": [
      "j_upper"
    ],
    "topic": "文言文实词",
    "name": "古今异义词以今释古",
    "description": "在翻译文言文时，直接用现代汉语中同形词的意思去解释古代汉语的词义。",
    "typical_error": "将“率妻子邑人来此绝境”翻译为“带领他的老婆来到这个无路可走的地方”。",
    "cause": "语言演变的知识储备不足，习惯用最熟悉的现代母语语汇去套解文言文材料的字面。"
  },
  {
    "id": "chi_reading_author_11",
    "subject": "语文",
    "stage": [
      "j_lower"
    ],
    "topic": "散文与小说阅读",
    "name": "文本中的“我”即作者",
    "description": "认为文章（尤其是第一人称小说或回忆性散文）中的叙述者“我”等同于作者本人的真实经历。",
    "typical_error": "在读鲁迅的《孔乙己》时，认为鲁迅小时候真的在咸亨酒店当过小伙计去给孔乙己温酒。",
    "cause": "缺乏文学叙事视角的概念（叙述者 vs 真实作者），将虚构文学作品当成了纪实材料。"
  },
  {
    "id": "chi_rhetoric_personification_12",
    "subject": "语文",
    "stage": [
      "j_lower"
    ],
    "topic": "修辞手法",
    "name": "拟人与拟物混淆",
    "description": "无法准确区分是将物赋予人的特征（拟人），还是把人赋予物的特征、把此物赋予彼物的特征（拟物）。",
    "typical_error": "将“人群像潮水一样涌了退，退了涌”这句拟物句（把人当水），判断为拟人修辞手法。",
    "cause": "对“拟”的认识过于宽泛，且“拟人”在小学阶段最常学到，形成了心理上的优先占位效应。"
  },
  {
    "id": "chi_reading_theme_16",
    "subject": "语文",
    "stage": [
      "j_upper"
    ],
    "topic": "现代文阅读",
    "name": "鲁迅文章主题的单一化解读",
    "description": "只要是鲁迅的文章，不管写什么内容，都一律拔高解读为批判封建礼教或揭露国民劣根性。",
    "typical_error": "读《社戏》里的美好童年回忆，也强行认为是反映了封建社会农村的黑暗与落后。",
    "cause": "对特定经典作家的“标签化”认知过重，失去了对文本具体情感（如温馨、怀念、纯真）的敏锐感知。"
  },
  {
    "id": "chi_reading_title_20",
    "subject": "语文",
    "stage": [
      "j_lower"
    ],
    "topic": "阅读习惯",
    "name": "忽略文章标题直接看正文",
    "description": "在做阅读理解时，从来不看文章标题，直接闷头读正文，导致抓不住文章的核心线索或线索物。",
    "typical_error": "做一篇名为《父亲的背影》的阅读题，读完之后还在苦苦寻找文章的线索到底是什么。",
    "cause": "缺乏宏观的阅读策略指导，不知道标题往往蕴含着主题、线索或核心事件等“文眼”。"
  },
  {
    "id": "chi_poem_rhythm_23",
    "subject": "语文",
    "stage": [
      "j_lower"
    ],
    "topic": "古诗词诵读",
    "name": "古诗诵读完全依靠标点停顿",
    "description": "读古诗词时，只知道在逗号和句号处停顿，不懂得按照诗词的节奏（如二二三或二三）和意义进行内部断句。",
    "typical_error": "读七言绝句时，一口气读完前面七个字才停下，完全没有“长风/破浪/会有时”的节奏感。",
    "cause": "将现代白话文的朗读习惯直接平移到文言韵文中，没有建立诗词音律美的基础体认。"
  },
  {
    "id": "chi_classical_translation_24",
    "subject": "语文",
    "stage": [
      "j_upper"
    ],
    "topic": "文言文翻译",
    "name": "只求意译忽略字字落实",
    "description": "在翻译文言文句子时，大致看懂了句意就随意用现代汉语的大白话概括出来，漏掉了关键实词和语法结构的准确翻译。",
    "typical_error": "将“微斯人，吾谁与归”直接概括翻译成“没有他我就不知道该怎么办了”，忽略了宾语前置等重要考点。",
    "cause": "在追求“信、达、雅”时过度倒向了“达”（通顺），忽略了考试给分点往往落在重点字词的“信”（准确）上。"
  },
  {
    "id": "chi_writing_material_26",
    "subject": "语文",
    "stage": [
      "j_upper"
    ],
    "topic": "写作素材",
    "name": "作文素材陈旧且万能化套用",
    "description": "不管面对什么作文题目，翻来覆去使用的论据永远是司马迁受宫刑、李白让力士脱靴、苏轼贬谪黄州等极少数几个人物。",
    "typical_error": "写“创新”、“坚持”、“乐观”、“爱国”，全都能把苏轼硬拉出来证明一遍。",
    "cause": "阅读面极其狭窄，缺乏对时代鲜活素材的关注，迷信所谓的“万能作文素材库”。"
  },
  {
    "id": "chi_reading_climax_27",
    "subject": "语文",
    "stage": [
      "j_upper"
    ],
    "topic": "小说阅读",
    "name": "梳理情节找不到核心冲突",
    "description": "在概括小说故事情节时，只是平铺直叙地列出发生的事件，找不出小说发展过程中的高潮和推动情节转折的根本矛盾。",
    "typical_error": "读《项链》，只看到玛蒂尔德借项链、丢项链、赔项链，看不到阶级虚荣心与残酷现实之间的戏剧性冲突本质。",
    "cause": "以看热闹的心态阅读小说，没有掌握人物、情节、环境三要素之间相互作用的叙事学模型。"
  },
  {
    "id": "chi_writing_topic_02_alt_junior",
    "subject": "语文",
    "stage": [
      "j_upper"
    ],
    "topic": "写作表达",
    "name": "作文必须写轰轰烈烈的大事",
    "description": "认为只有写救人、患重病等极端事件才能得高分。",
    "typical_error": "我为了写感人的作文，只能编造外婆生重病的故事。",
    "cause": "对“以小见大”的写作手法掌握不足，缺乏从日常生活中发现美的能力。"
  },
  {
    "id": "chi_vocabulary_emotion_04_alt_junior",
    "subject": "语文",
    "stage": [
      "j_upper"
    ],
    "topic": "词语运用",
    "name": "成语只能用在正式文体中",
    "description": "认为成语过于文雅，不能用在描写日常生活的记叙文中。",
    "typical_error": "写我和同学打闹，用成语显得太假了。",
    "cause": "对成语的语体色彩认识不清。"
  },
  {
    "id": "chi_rhetoric_metaphor_08_alt_junior",
    "subject": "语文",
    "stage": [
      "j_lower"
    ],
    "topic": "修辞手法",
    "name": "带有'像'的句子都是比喻句",
    "description": "看到'像'、'仿佛'就判定为比喻修辞。",
    "typical_error": "认为'他长得很像他爸爸'是一个比喻句。",
    "cause": "忽略了比喻必须是两个不同类事物的基本前提。"
  },
  {
    "id": "chi_reading_author_11_alt_junior",
    "subject": "语文",
    "stage": [
      "j_upper"
    ],
    "topic": "散文与小说阅读",
    "name": "小说里的故事都是作者亲身经历的",
    "description": "将小说等文学虚构作品中的第一人称叙述者等同于现实中的作者本人。",
    "typical_error": "鲁迅在《狂人日记》里写自己发疯了。",
    "cause": "混淆了现实生活与文学创作（虚构）的界限。"
  },
  {
    "id": "chi_writing_style_13_alt_junior",
    "subject": "语文",
    "stage": [
      "j_lower"
    ],
    "topic": "写作表达",
    "name": "写记叙文必须按照时间顺序",
    "description": "不知道倒叙、插叙的存在，文章总是从“早上起床”写起。",
    "typical_error": "写难忘的一件事，花了一半篇幅写怎么出门坐车。",
    "cause": "缺乏结构布局意识。"
  },
  {
    "id": "chi_reading_title_20_alt_junior",
    "subject": "语文",
    "stage": [
      "j_upper"
    ],
    "topic": "阅读习惯",
    "name": "文章标题等同于中心论点",
    "description": "在分析议论文或散文时，直接把标题抄下来作为全文的中心思想。",
    "typical_error": "问文章主旨是什么，直接回答：就是标题《春》。 ",
    "cause": "没有深入阅读文本，试图寻找偷懒的答题捷径。"
  },
  {
    "id": "chi_character_form_25_alt_junior",
    "subject": "语文",
    "stage": [
      "j_lower"
    ],
    "topic": "汉字书写与辨析",
    "name": "会读的字就一定会写",
    "description": "对汉字的字形记忆不深，容易写出同音别字。",
    "typical_error": "把'走投无路'写成'走头无路'。",
    "cause": "阅读多于手写，且缺乏对汉字造字理据（如形声字表意）的分析。"
  }
]