[
  {
    "id": "bio_plant_respiration_01",
    "subject": "生物",
    "stage": [
      "j_lower"
    ],
    "topic": "植物的呼吸作用",
    "name": "植物只进行光合不呼吸",
    "description": "认为只有动物需要呼吸，植物只进行光合作用吸收二氧化碳释放氧气。",
    "typical_error": "植物是不需要呼吸的，它们白天晚上都在制造氧气，所以晚上在卧室放很多植物对身体好。",
    "cause": "光合作用的概念深入人心，掩盖了所有活细胞都需要通过呼吸作用释放能量的普遍规律。"
  },
  {
    "id": "bio_evolution_teleology_02",
    "subject": "生物",
    "stage": [
      "j_upper"
    ],
    "topic": "生物的进化",
    "name": "进化的目的论（拉马克主义）",
    "description": "认为生物为了适应环境，会主动产生有利变异，即“用进废退”。",
    "typical_error": "长颈鹿因为要吃高处的树叶，所以脖子越伸越长，最后进化出了长脖子。",
    "cause": "缺乏对达尔文“自然选择”（盲目变异、适者生存）的理解，习惯以人类的“主观意图”去解释自然现象。"
  },
  {
    "id": "bio_cell_wall_03",
    "subject": "生物",
    "stage": [
      "j_lower"
    ],
    "topic": "细胞的结构",
    "name": "所有细胞都有细胞壁",
    "description": "认为动物细胞和植物细胞结构完全相同，都具有细胞壁和叶绿体。",
    "typical_error": "人也是生物，植物也是生物，所以人的细胞外面肯定也有一圈硬硬的细胞壁保护着。",
    "cause": "概念学习初期对“细胞”特征的过度泛化，没有理解不同生物界别细胞结构的特异性。"
  },
  {
    "id": "bio_blood_artery_04",
    "subject": "生物",
    "stage": [
      "j_lower"
    ],
    "topic": "人体血液循环",
    "name": "动脉里流的都是动脉血",
    "description": "认为只要名字叫“动脉”的血管，里面流动的就一定是富含氧气的鲜红色“动脉血”。",
    "typical_error": "肺动脉叫动脉，所以肺动脉里流的肯定是鲜红色的动脉血。",
    "cause": "名词字面意思的误导，没有理解动脉/静脉是根据血流方向（离心/回心）划分，而动脉血/静脉血是根据含氧量划分的。"
  },
  {
    "id": "bio_disease_genetic_05",
    "subject": "生物",
    "stage": [
      "j_upper"
    ],
    "topic": "人类遗传病",
    "name": "先天性疾病就是遗传病",
    "description": "将“一生下来就有的病（先天性疾病）”与“由遗传物质改变引起的病（遗传病）”完全等同。",
    "typical_error": "他一出生就有这个病，这肯定是遗传病，他父母肯定也有或者带有这个基因。",
    "cause": "生活常识的模糊性，忽略了孕期环境因素（如辐射、药物）导致的非遗传性先天缺陷。"
  },
  {
    "id": "bio_genetics_dominant_06",
    "subject": "生物",
    "stage": [
      "j_upper"
    ],
    "topic": "基因的显性和隐性",
    "name": "显性基因比隐性基因“更强”或“更多”",
    "description": "认为显性基因在人群中的数量一定比隐性基因多，或者显性基因在生理功能上更“优越”。",
    "typical_error": "双眼皮是显性基因，单眼皮是隐性基因，所以以后人类全都会变成双眼皮，单眼皮会被淘汰。",
    "cause": "对“显/隐”字面意义的过度解读，不理解基因频率取决于环境选择压力而非显隐性。"
  },
  {
    "id": "bio_ecology_energy_07",
    "subject": "生物",
    "stage": [
      "j_upper"
    ],
    "topic": "生态系统的能量流动",
    "name": "生态系统能量可以循环",
    "description": "混淆了物质循环和能量流动，认为能量在食物链中传递后，最终还能通过分解者回到植物体重新利用。",
    "typical_error": "太阳能被植物吸收后，传给动物，动物死后被细菌分解，能量又回到了土壤里让植物再次利用。",
    "cause": "未建立起热力学第二定律在生态学中的映射（能量单向流动、逐级递减、最终以热能散失）。"
  },
  {
    "id": "bio_microbe_virus_08",
    "subject": "生物",
    "stage": [
      "j_lower"
    ],
    "topic": "病毒与细菌",
    "name": "病毒具有细胞结构",
    "description": "认为所有微小的病原微生物（包括病毒）都具有细胞膜、细胞质等基本细胞结构。",
    "typical_error": "新冠病毒也是一种细胞，它有自己的细胞核和细胞壁。",
    "cause": "将“生物都由细胞构成”这一普遍规律过度泛化，忽略了病毒作为非细胞生物的特殊类群。"
  },
  {
    "id": "bio_nervous_reflex_09",
    "subject": "生物",
    "stage": [
      "j_lower"
    ],
    "topic": "神经调节",
    "name": "反射可以不需要神经中枢",
    "description": "认为非条件反射（如膝跳反射）只在感受器和效应器之间直接传递，不需要经过中枢神经系统。",
    "typical_error": "敲一下膝盖腿就弹起来了，这么快肯定没经过大脑和脊髓，是直接从腿部传导的。",
    "cause": "对反射弧五个基本环节缺一不可的原则认识不清，容易把“不受大脑意识控制”等同于“不需要神经中枢”。"
  },
  {
    "id": "bio_plant_photosynthesis_10",
    "subject": "生物",
    "stage": [
      "j_lower"
    ],
    "topic": "植物的光合作用",
    "name": "光合作用只在叶片发生",
    "description": "认为植物只有叶片这一个器官能够进行光合作用，忽略了其他含有叶绿体的绿色部位。",
    "typical_error": "仙人掌的叶子变成了刺，没有绿色的叶片了，所以它没法进行光合作用自己制造养分。",
    "cause": "教材中通常以叶片为典型代表讲解光合作用，导致学生形成了狭隘的部位锚定。"
  },
  {
    "id": "bio_blood_type_11",
    "subject": "生物",
    "stage": [
      "j_upper"
    ],
    "topic": "孟德尔遗传规律",
    "name": "父母同血型孩子必同血型",
    "description": "认为父母都是 A 型血，生出来的孩子绝对不可能是 O 型血。",
    "typical_error": "他爸妈都是 A 型血，他却是 O 型血，肯定是抱错了。",
    "cause": "不理解 ABO 血型的复等位基因遗传规律（IAi 与 IAi 婚配可能生出 ii）。"
  },
  {
    "id": "bio_food_chain_14",
    "subject": "生物",
    "stage": [
      "j_lower"
    ],
    "topic": "生态系统",
    "name": "食物链可以无限长",
    "description": "只要动物足够多，大鱼吃小鱼，食物链就可以一直往上排，包含十几个甚至几十个营养级。",
    "typical_error": "在广阔的海洋里，食物链可以排成：浮游植物-虾-小鱼-大鱼-鲨鱼-大鲨鱼-超级鲨鱼...有无数个环节。",
    "cause": "没有能量逐级递减（10%-20%传递效率）的数学常识，不知道能量耗散会限制食物链的长度（通常不超过五个营养级）。"
  },
  {
    "id": "bio_mutation_harmful_17",
    "subject": "生物",
    "stage": [
      "j_upper"
    ],
    "topic": "基因突变",
    "name": "所有突变都是有害的",
    "description": "认为基因突变一定会导致疾病、畸形甚至死亡，是一种纯粹负面的现象。",
    "typical_error": "被核辐射导致基因突变了，那肯定会得癌症，不会变成有什么超能力的怪物，突变全都是坏事。",
    "cause": "日常新闻中接触到的突变案例（如癌症、遗传病）多为负面，忽略了中性突变和有利突变是生物进化的原材料。"
  },
  {
    "id": "bio_cell_division_18",
    "subject": "生物",
    "stage": [
      "j_upper"
    ],
    "topic": "细胞分裂",
    "name": "有丝分裂产生生殖细胞",
    "description": "不区分体细胞和生殖细胞的增殖方式，认为精子和卵细胞也是通过普通的有丝分裂产生的。",
    "typical_error": "人的卵巢细胞通过有丝分裂生成了卵细胞，所以卵细胞里也有 46 条染色体。",
    "cause": "学习减数分裂之前，学生默认所有细胞的增殖都是通过有丝分裂这一种方式完成的。"
  },
  {
    "id": "bio_nervous_brain_19",
    "subject": "生物",
    "stage": [
      "j_lower"
    ],
    "topic": "神经系统",
    "name": "所有的反应都由大脑控制",
    "description": "认为身体的一切无意识反应和低级反射都是直接由大脑这个最高司令部发出的指令。",
    "typical_error": "手碰到滚烫的开水迅速缩回来，是因为手把痛觉报告给大脑，大脑赶紧命令手缩回来。",
    "cause": "对“大脑是控制中枢”的过度拔高，忽略了脊髓作为低级中枢在处理紧急反射（如缩手反射）中的独立作用。"
  },
  {
    "id": "bio_plant_water_20",
    "subject": "生物",
    "stage": [
      "j_lower"
    ],
    "topic": "植物的水分代谢",
    "name": "吸收的水主要用于光合作用",
    "description": "认为植物根系辛辛苦苦吸收的水分，绝大部分都被用来作为原料进行光合作用制造养料了。",
    "typical_error": "大树每天吸那么多水，都是为了进行光合作用长得更壮。",
    "cause": "对蒸腾作用的认知盲区，不了解植物吸收的水分有 90% 以上都通过气孔蒸发到了大气中。"
  },
  {
    "id": "bio_respiration_lung_21",
    "subject": "生物",
    "stage": [
      "j_lower"
    ],
    "topic": "人体呼吸",
    "name": "细胞呼吸等同于肺部呼吸",
    "description": "认为“呼吸作用”就是在肺里进行的吸入氧气、呼出二氧化碳的气体交换过程。",
    "typical_error": "我用肺在呼吸，所以呼吸作用就是肺部在工作，肌肉细胞是不需要呼吸的。",
    "cause": "宏观生理学概念（器官层面的呼吸）覆盖了微观细胞生物学概念（线粒体内的氧化分解）。"
  },
  {
    "id": "bio_chromosome_number_22",
    "subject": "生物",
    "stage": [
      "j_upper"
    ],
    "topic": "染色体",
    "name": "染色体越多生物越高级",
    "description": "认为高等生物的染色体数目一定比低等生物多，智商越高的生物染色体越多。",
    "typical_error": "人类是最聪明的生物，所以人的 46 条染色体绝对比猫猫狗狗和植物的都要多。",
    "cause": "对“复杂性”的错误归因，实际上蕨类植物可能有几百条染色体，染色体数目与物种高级程度无关。"
  },
  {
    "id": "bio_protein_energy_23",
    "subject": "生物",
    "stage": [
      "j_lower"
    ],
    "topic": "人体营养",
    "name": "蛋白质是主要供能物质",
    "description": "因为生活中常说“多吃肉蛋奶补充营养”，就认为蛋白质是人体获取能量的主要来源。",
    "typical_error": "跑步没力气了，吃牛肉比吃米饭更能快速补充体力，因为牛肉蛋白质多。",
    "cause": "生活保健广告的误导，未能区分物质结构基础（蛋白质）与主要能源物质（糖类）的功能差异。"
  },
  {
    "id": "bio_cell_nucleus_29",
    "subject": "生物",
    "stage": [
      "j_lower"
    ],
    "topic": "细胞结构",
    "name": "所有活细胞都有细胞核",
    "description": "认为只要是真核生物的细胞，不管处于什么状态，内部必定有一个控制中心——细胞核。",
    "typical_error": "人的血液里有红细胞，红细胞要运输氧气，这么重要它肯定有一个大大的细胞核。",
    "cause": "初学显微镜观察洋葱表皮细胞时建立的典型模型固化，忽略了哺乳动物成熟红细胞为了容纳血红蛋白而丢失细胞核的特化适应。"
  },
  {
    "id": "bio_microbe_antibiotic_30",
    "subject": "生物",
    "stage": [
      "j_lower"
    ],
    "topic": "传染病与免疫",
    "name": "抗生素能治病毒性感冒",
    "description": "生活中一生病就吃阿莫西林、头孢，误以为抗生素是包治百病的灵丹妙药，包括病毒感染。",
    "typical_error": "我得了流感（流感病毒），赶紧吃几粒阿莫西林（青霉素类）杀杀毒。",
    "cause": "公众医疗常识的误区，不了解抗生素只针对细菌的细胞壁或核糖体起作用，对没有细胞结构的病毒毫无办法。"
  },
  {
    "id": "bio_plant_respiration_01_alt_junior",
    "subject": "生物",
    "stage": [
      "j_upper"
    ],
    "topic": "植物的呼吸作用",
    "name": "植物只在晚上呼吸",
    "description": "认为植物白天只进行光合作用，晚上才进行呼吸作用。",
    "typical_error": "植物白天不需要氧气，晚上才吸收氧气。",
    "cause": "对植物两种生理过程独立性和同时性认识不足。"
  },
  {
    "id": "bio_cell_wall_03_alt_junior",
    "subject": "生物",
    "stage": [
      "j_upper"
    ],
    "topic": "细胞的结构",
    "name": "动物细胞也有细胞壁",
    "description": "认为所有细胞都具有细胞壁结构。",
    "typical_error": "人的细胞外面也有一层坚硬的细胞壁保护。",
    "cause": "未能清楚区分动植物细胞结构的差异。"
  },
  {
    "id": "bio_microbe_antibiotic_30_alt_junior",
    "subject": "生物",
    "stage": [
      "j_upper"
    ],
    "topic": "传染病与免疫",
    "name": "细菌都是有害的",
    "description": "认为所有的细菌都会引起疾病。",
    "typical_error": "我们必须消灭环境中所有的细菌才能保持健康。",
    "cause": "受到日常宣传中对病菌防范的片面影响，忽视了益生菌及分解者的作用。"
  }
]