[
  {
    "id": "history_ancient_cn_01",
    "subject": "history",
    "stage": [
      "j_lower"
    ],
    "topic": "秦朝制度",
    "name": "秦始皇建立分封制",
    "description": "错误地认为秦始皇统一中国后实行的是分封制。",
    "typical_error": "秦始皇统一六国后，把他的儿子和功臣分封到各地做诸侯王。",
    "cause": "混淆了西周的“分封制”与秦朝确立的“郡县制”，未能掌握秦朝废除分封制、推行郡县制的历史事实。"
  },
  {
    "id": "history_modern_cn_01",
    "subject": "history",
    "stage": [
      "j_upper"
    ],
    "topic": "《南京条约》",
    "name": "割让整个台湾",
    "description": "认为中英《南京条约》中割让给英国的是整个台湾岛。",
    "typical_error": "1842年《南京条约》签订，中国把台湾割让给了英国。",
    "cause": "混淆了《南京条约》（割让香港岛）与《马关条约》（割让台湾及附属岛屿、澎湖列岛）的内容。"
  },
  {
    "id": "history_modern_cn_02",
    "subject": "history",
    "stage": [
      "j_lower"
    ],
    "topic": "鸦片战争",
    "name": "林则徐禁烟是根本原因",
    "description": "认为鸦片战争爆发的根本原因是林则徐虎门销烟惹怒了英国。",
    "typical_error": "如果林则徐没有去虎门销烟，英国就不会发动鸦片战争了。",
    "cause": "没有区分直接原因（导火线）和根本原因（英国企图打开中国市场，倾销商品和掠夺原料）。"
  },
  {
    "id": "history_modern_cn_03",
    "subject": "history",
    "stage": [
      "j_upper"
    ],
    "topic": "洋务运动",
    "name": "洋务运动使中国走上富强",
    "description": "认为洋务运动成功实现了其“自强”“求富”的目标，使中国彻底富强。",
    "typical_error": "洋务运动学习了西方的先进技术，因此成功地让中国摆脱了落后，走向了富强。",
    "cause": "只看到了洋务运动对中国近代化的客观促进作用，忽略了甲午中日战争北洋舰队全军覆没标志着洋务运动最终破产的事实。"
  },
  {
    "id": "history_ancient_world_01",
    "subject": "history",
    "stage": [
      "j_lower"
    ],
    "topic": "古希腊文明",
    "name": "古希腊是一个统一国家",
    "description": "认为古希腊就像中国古代的王朝一样，是一个拥有统一中央集权的国家。",
    "typical_error": "古希腊的首都是雅典，国王统治着整个希腊地区。",
    "cause": "用中国古代的“大一统”思维去套用古希腊历史，没有掌握古希腊城邦林立、各自独立的特点。"
  },
  {
    "id": "history_modern_world_01",
    "subject": "history",
    "stage": [
      "j_upper"
    ],
    "topic": "文艺复兴",
    "name": "纯粹复古无创新",
    "description": "从字面意思理解，认为文艺复兴仅仅是恢复和模仿古希腊罗马文化。",
    "typical_error": "文艺复兴就是当时的人觉得古希腊罗马的文化好，所以照抄了一遍，没有创造新的东西。",
    "cause": "被“复兴”二字误导，没有理解文艺复兴的实质是资产阶级借复兴古典文化之名，宣扬资产阶级思想文化的新文化运动。"
  },
  {
    "id": "history_modern_world_02",
    "subject": "history",
    "stage": [
      "j_lower"
    ],
    "topic": "工业革命",
    "name": "混淆两次工业革命标志",
    "description": "将第一次工业革命和第二次工业革命的代表性发明混为一谈。",
    "typical_error": "瓦特发明改良蒸汽机标志着人类进入了“电气时代”。",
    "cause": "对历史事件的时间节点和特征记忆模糊。第一次工业革命的核心是蒸汽机（蒸汽时代），第二次是电力和内燃机（电气时代）。"
  },
  {
    "id": "history_modern_cn_04",
    "subject": "history",
    "stage": [
      "j_upper"
    ],
    "topic": "辛亥革命",
    "name": "彻底改变了社会性质",
    "description": "认为辛亥革命彻底完成了反帝反封建的任务，改变了中国半殖民地半封建社会的性质。",
    "typical_error": "辛亥革命推翻了清王朝，从此中国就不再是半殖民地半封建社会了。",
    "cause": "混淆了推翻“封建君主专制制度”与推翻“封建制度”的区别。辛亥革命没有改变中国半殖民地半封建的社会性质。"
  },
  {
    "id": "history_time_01",
    "subject": "history",
    "stage": [
      "j_lower"
    ],
    "topic": "历史纪年",
    "name": "世纪与年代计算错误",
    "description": "在将具体年份转换为世纪时出现差错，通常是忘记加一。",
    "typical_error": "1911年爆发的辛亥革命发生于19世纪初期。",
    "cause": "缺乏纪年换算的基本常识。N世纪是指(N-1)00年到(N-1)99年（严格说为(N-1)01到N00年），因此1911年属于20世纪。"
  },
  {
    "id": "history_ancient_cn_02",
    "subject": "history",
    "stage": [
      "j_upper"
    ],
    "topic": "丝绸之路",
    "name": "仅运输丝绸无文化交流",
    "description": "认为丝绸之路仅仅是一条商贸路线，且只运输丝绸，没有文化和其他物质的交流。",
    "typical_error": "丝绸之路顾名思义就是古代中国用来往外运送丝绸的路，跟其他东西和文化没关系。",
    "cause": "望文生义，忽略了丝绸之路作为东西方经济文化交流大动脉的综合历史作用（如佛教东传、四大发明西传等）。"
  }
]