[
  {
    "id": "math_fraction_average_01",
    "subject": "数学",
    "stage": [
      "p_middle"
    ],
    "topic": "分数的初步认识",
    "name": "不理解“平均分”的严格性",
    "description": "认为只要把一个物体分成几份，其中一份就是几分之一，忽略了“必须等大/平均分”的前提条件。",
    "typical_error": "老师，我把这个不规则的饼干掰成了两块，虽然大小不一样，但这一块还是二分之一！",
    "cause": "日常生活中“一半”往往不要求严格等大，生活经验对数学概念产生了负迁移。"
  },
  {
    "id": "math_fraction_compare_02",
    "subject": "数学",
    "stage": [
      "p_middle"
    ],
    "topic": "分数比较大小",
    "name": "整数经验的负迁移",
    "description": "在比较同分子分数（几分之一）的大小时，认为分母越大分数越大。",
    "typical_error": "我觉得 1/4 比 1/2 大，因为 4 比 2 大啊。",
    "cause": "过度泛化整数比较大小的规则，没有理解分母代表的是分的份数（份数越多每一份越小）。"
  },
  {
    "id": "math_fraction_readwrite_03",
    "subject": "数学",
    "stage": [
      "p_middle"
    ],
    "topic": "分数的读写",
    "name": "读写顺序混淆",
    "description": "写分数时先写分子后写分母，或者读分数时先读分子后读分母。",
    "typical_error": "写三分之一的时候，先在上面写1，再画一条线，最后在下面写3。",
    "cause": "受到汉语从上到下、从左到右书写习惯的影响，未能掌握“分数线-分母-分子”的书写规范。"
  },
  {
    "id": "math_geometry_area_perimeter_04",
    "subject": "数学",
    "stage": [
      "p_middle"
    ],
    "topic": "面积与周长",
    "name": "面积和周长概念混淆",
    "description": "将计算周长的公式用于计算面积，或将计算面积的公式用于计算周长；认为周长相等的图形面积也一定相等。",
    "typical_error": "这个长方形的长是4，宽是3，它的面积是 (4+3)×2 = 14！",
    "cause": "两个概念是在相近的时间段内学习的，且都涉及长度单位和乘法计算，学生未能从本质上区分一维长度和二维面积。"
  },
  {
    "id": "math_algebra_equals_05",
    "subject": "数学",
    "stage": [
      "p_lower"
    ],
    "topic": "等式的认识",
    "name": "认为等号只代表“得出结果”",
    "description": "将等号理解为一个动作指令，意思是“计算出答案”，而不是等价关系符号。",
    "typical_error": "在题目 3 + 4 = 2 + ( ) 中，学生会在括号里填 7，把式子变成 3 + 4 = 7 + ( )。",
    "cause": "低年级大量的单向运算练习（如 3+4=?）导致学生形成了定势思维，缺乏代数式的平衡与对称观念。"
  },
  {
    "id": "math_number_zero_divide_06",
    "subject": "数学",
    "stage": [
      "p_middle"
    ],
    "topic": "除法运算",
    "name": "死记硬背0不能做除数",
    "description": "知道“0不能做除数”的规则，但不理解为什么，在含有字母的代数式中容易忽略对分母是否为0的讨论。",
    "typical_error": "遇到 a/b = c 时，直接认为可以随意变形，忽略 b≠0 的隐藏条件。",
    "cause": "学习时仅作为规定背诵，没有通过乘除法互逆关系（如0乘任何数都不等于非零被除数）去深入推导。"
  },
  {
    "id": "math_decimal_align_07",
    "subject": "数学",
    "stage": [
      "p_upper"
    ],
    "topic": "小数运算",
    "name": "小数点对齐与末尾对齐混淆",
    "description": "在进行小数乘法时，错误地要求小数点对齐；或者在小数加减法时，错误地要求末位对齐。",
    "typical_error": "计算 2.5 × 1.25 时，强行把小数点对齐写成竖式，导致计算繁琐和错误。",
    "cause": "将加减法（相同数位对齐）和乘法（末位对齐，最后数小数位数）的法则死记硬背且相互干扰。"
  },
  {
    "id": "math_geometry_altitude_08",
    "subject": "数学",
    "stage": [
      "p_upper"
    ],
    "topic": "三角形的高",
    "name": "认为图形的高只能在内部",
    "description": "在画三角形的高时，认为高必须落在三角形的内部，遇到钝角三角形时无法画出外部的高。",
    "typical_error": "给钝角三角形画高时，把高画成了一条斜线以保证它落在底边内部。",
    "cause": "视觉原型的局限性，教材早期给出的多为锐角三角形示例，固化了高的几何位置表象。"
  },
  {
    "id": "math_arithmetic_multiply_larger_09",
    "subject": "数学",
    "stage": [
      "p_upper"
    ],
    "topic": "分数的乘法",
    "name": "乘法总是使结果变大",
    "description": "认为一个数乘以另一个数，结果一定比原来的数大，导致在估算分数或小数乘法时判断失误。",
    "typical_error": "觉得 5 × (1/2) 的结果一定大于 5，所以算出来 2.5 觉得是自己算错了。",
    "cause": "自然数乘法的经验（本质是连加）被不加限制地泛化到了有理数集。"
  },
  {
    "id": "math_measurement_unit_10",
    "subject": "数学",
    "stage": [
      "p_middle"
    ],
    "topic": "单位换算",
    "name": "进率盲目类推",
    "description": "认为所有相邻单位之间的进率都是10或者100，混淆不同维度（长度、面积、时间等）的进率规则。",
    "typical_error": "认为1小时=100分钟，或者1平方米=10平方分米。",
    "cause": "十进制计数法的强烈惯性，掩盖了时间（六十进制）和面积（二维导致进率平方）的特殊性。"
  },
  {
    "id": "math_geometry_angle_13",
    "subject": "数学",
    "stage": [
      "p_middle"
    ],
    "topic": "角的认识",
    "name": "角的大小取决于边的长短",
    "description": "认为角的两边画得越长，这个角就越大。",
    "typical_error": "对比一个画得很长的小锐角和一个画得很短的钝角，认为锐角更大。",
    "cause": "儿童对图形的视觉注意力容易被具有显著特征的部分（如线段长度）吸引，忽略了角的本质是旋转量。"
  },
  {
    "id": "math_statistics_average_27",
    "subject": "数学",
    "stage": [
      "p_upper"
    ],
    "topic": "统计学",
    "name": "平均数等同于一般水平",
    "description": "认为算术平均数总能代表一组数据的“中等”或“普遍”情况，忽略了极端值（离群点）对平均数的巨大影响。",
    "typical_error": "在一个收入极度不平等的公司里，用平均月薪 2 万来代表普通员工的真实收入水平。",
    "cause": "对中位数、众数、平均数这三大集中趋势统计量各自的适用场景认知不清。"
  },
  {
    "id": "math_geometry_area_perimeter_04_alt_primary",
    "subject": "数学",
    "stage": [
      "p_upper"
    ],
    "topic": "面积与周长",
    "name": "周长越长面积越大",
    "description": "认为周长和面积是完全正相关的量。",
    "typical_error": "一根绳子围成长方形，不管怎么围面积都一样大。",
    "cause": "没有经历过等周长不同形状面积变化的探究活动。"
  },
  {
    "id": "math_algebra_equals_05_alt_primary",
    "subject": "数学",
    "stage": [
      "p_middle"
    ],
    "topic": "等式的认识",
    "name": "等式两边不能同时有未知数",
    "description": "认为解方程就是“未知数在左边，数字在右边”，拒绝接受两边都有x的式子。",
    "typical_error": "看到 2x + 1 = x + 3 不知所措。",
    "cause": "过度习惯了算术题的单向运算模式。"
  },
  {
    "id": "math_number_zero_divide_06_alt_primary",
    "subject": "数学",
    "stage": [
      "p_upper"
    ],
    "topic": "除法运算",
    "name": "0除以任何数都没有意义",
    "description": "混淆了“0不能做除数”和“0做被除数”的区别。",
    "typical_error": "认为 0 ÷ 5 是没有意义的。",
    "cause": "对于运算规则的死记硬背产生了记忆混乱。"
  }
]