[
  {
    "id": "chem_particle_molecule_01",
    "subject": "化学",
    "stage": [
      "j_upper"
    ],
    "topic": "物质构成的奥秘",
    "name": "认为分子是构成物质的唯一微粒",
    "description": "忽略原子、离子的存在，认为所有物质都由分子构成。",
    "typical_error": "水是水分子构成的，那铁肯定是由铁分子构成的，食盐是由食盐分子构成的。",
    "cause": "初接触微观概念时，“分子”这一概念最为常见且易于联想，导致对微观粒子种类的认知单一化。"
  },
  {
    "id": "chem_change_physical_02",
    "subject": "化学",
    "stage": [
      "j_upper"
    ],
    "topic": "物质的变化和性质",
    "name": "混淆物理变化和化学变化",
    "description": "仅从宏观现象（如发光、发热、变色、产生气体等）判断是否为化学变化，而忽略了“是否有新物质生成”这一本质特征。",
    "typical_error": "灯泡通电发光发热了，水烧开冒气泡了，这些肯定都是化学变化！",
    "cause": "过度依赖直观感知，没有建立起微观层面上分子是否发生改变的本质认知。"
  },
  {
    "id": "chem_mass_conservation_03",
    "subject": "化学",
    "stage": [
      "j_upper"
    ],
    "topic": "质量守恒定律",
    "name": "燃烧质量减轻违反质量守恒",
    "description": "观察到木炭燃烧后只剩下少量灰烬，就认为质量守恒定律在燃烧过程中不适用。",
    "typical_error": "木头烧完就变轻了，这说明物质在燃烧中消失了，质量是不守恒的。",
    "cause": "只关注了固态物质的质量变化，忽略了反应物中的氧气以及生成物中逃逸到空气中的二氧化碳气体。"
  },
  {
    "id": "chem_solution_solubility_04",
    "subject": "化学",
    "stage": [
      "j_upper"
    ],
    "topic": "溶液与溶解度",
    "name": "溶解度与溶剂体积成正比",
    "description": "认为加入更多的水（溶剂），物质的溶解度就会变大。",
    "typical_error": "如果我在杯子里多加点水，盐的溶解度就增加了，就能溶更多盐了。",
    "cause": "混淆了“溶解的质量”与“溶解度”（固定溶剂量下的最大溶解质量）这两个不同的概念。"
  },
  {
    "id": "chem_acid_base_structure_05",
    "subject": "化学",
    "stage": [
      "j_upper"
    ],
    "topic": "酸和碱",
    "name": "酸碱成分的绝对化",
    "description": "认为所有显酸性的物质都是酸（必须含氢），所有显碱性的物质都是碱（必须含氢氧根）。",
    "typical_error": "碳酸钠（纯碱）的水溶液显碱性，所以碳酸钠肯定是一种碱，里面有氢氧根离子。",
    "cause": "从初中阿伦尼乌斯酸碱理论向高中更广义酸碱理论过渡时，未能理解盐类水解也会导致溶液显酸碱性。"
  },
  {
    "id": "chem_catalyst_speedup_06",
    "subject": "化学",
    "stage": [
      "j_upper"
    ],
    "topic": "催化剂",
    "name": "催化剂必定是“加速剂”",
    "description": "认为催化剂的作用仅仅是加快化学反应速率，忽略了它可以减慢反应速率，也容易忘记其质量和化学性质反应前后不变。",
    "typical_error": "催化剂就是用来让反应变快的，反应结束后催化剂就被消耗掉了一部分。",
    "cause": "日常语境中“催化”一词带有强烈的“促进、加速”色彩，掩盖了其改变反应活化能的本质。"
  },
  {
    "id": "chem_ion_charge_create_07",
    "subject": "化学",
    "stage": [
      "j_upper"
    ],
    "topic": "离子与核外电子",
    "name": "离子带电是因为产生了新电荷",
    "description": "不理解离子的形成是电子得失的结果，认为离子带电是因为内部“产生”了正电荷或负电荷。",
    "typical_error": "钠原子变成钠离子，是因为它体内产生了一个正电荷，所以带正电了。",
    "cause": "缺乏电荷守恒观念，对原子核外电子排布和得失电子趋向稳定结构的机制认知不清。"
  },
  {
    "id": "chem_metal_activity_08",
    "subject": "化学",
    "stage": [
      "j_upper"
    ],
    "topic": "金属活动性",
    "name": "活动性完全等同于反应剧烈程度",
    "description": "在任何情况下，都认为金属活动性顺序表中排在前面的金属，反应一定比排在后面的剧烈，忽略浓度、接触面积等外部条件。",
    "typical_error": "镁排在铁前面，所以块状的镁跟酸反应，绝对比铁粉跟酸反应要快！",
    "cause": "对化学原理的应用机械化，没有控制变量的科学思维，忽视了宏观动力学条件对速率的影响。"
  },
  {
    "id": "chem_solution_saturated_09",
    "subject": "化学",
    "stage": [
      "j_upper"
    ],
    "topic": "溶液",
    "name": "饱和溶液不能再溶解任何物质",
    "description": "认为某物质的饱和溶液就像“装满的盒子”，不能再溶解任何其他种类的溶质了。",
    "typical_error": "这杯盐水已经饱和了，底下都有盐粒了，所以往里面加糖，糖也肯定溶化不了。",
    "cause": "将溶液的饱和状态绝对化，没有理解饱和是针对“特定溶质”而言的微观动态平衡。"
  },
  {
    "id": "chem_oxidation_oxygen_11",
    "subject": "化学",
    "stage": [
      "j_upper"
    ],
    "topic": "氧化还原反应",
    "name": "氧化反应必须有氧气参与",
    "description": "认为只有物质与氧气发生反应才叫氧化反应，忽略了广义上得失电子（或共用电子对偏移）的本质。",
    "typical_error": "氢气在氯气中燃烧生成氯化氢，这里面没有氧气，所以绝对不是氧化还原反应。",
    "cause": "初中阶段对“氧化”一词基于“得氧失氧”的狭义定义产生了深刻的负迁移。"
  },
  {
    "id": "chem_atomic_mass_12",
    "subject": "化学",
    "stage": [
      "j_upper"
    ],
    "topic": "相对原子质量",
    "name": "相对原子质量带有真实质量单位",
    "description": "认为相对原子质量是有物理单位的（如“克”或“千克”）。",
    "typical_error": "氧的相对原子质量是 16 克。",
    "cause": "未能理解“相对”二字代表的是一个比值（与碳12原子质量的1/12相比），将它与摩尔质量的单位混淆。"
  },
  {
    "id": "chem_ph_scale_17",
    "subject": "化学",
    "stage": [
      "j_upper"
    ],
    "topic": "溶液的酸碱性",
    "name": "pH 值被限制在 0-14 之间",
    "description": "认为 pH 值绝对不可能小于 0 或者大于 14。",
    "typical_error": "酸性再强的酸，pH 最小也只能是 0，不可能变成负数。",
    "cause": "教材通常只展示 0-14 的 pH 试纸色卡，导致学生忽略了浓酸浓碱中 H+ 浓度超过 1mol/L 时 pH 可超出此范围。"
  },
  {
    "id": "chem_salt_neutral_19",
    "subject": "化学",
    "stage": [
      "j_upper"
    ],
    "topic": "盐类水解",
    "name": "盐溶液一定呈中性",
    "description": "认为既然盐是酸和碱中和的产物，那么所有盐的水溶液都应该是中性的（pH=7）。",
    "typical_error": "碳酸钠是盐，所以它的水溶液肯定是中性的。",
    "cause": "对“中和反应”字面意思的误解，不知道强碱弱酸盐或强酸弱碱盐会发生水解而显碱性或酸性。"
  },
  {
    "id": "chem_redox_electron_30",
    "subject": "化学",
    "stage": [
      "j_upper"
    ],
    "topic": "氧化还原反应",
    "name": "氧化剂失去电子",
    "description": "由于名字叫“氧化剂”，就望文生义地认为它在反应中被氧化，从而失去了电子。",
    "typical_error": "氧化剂肯定是发生氧化反应的，氧化反应就是失去电子，所以氧化剂失去电子。",
    "cause": "术语名称（施动者和受动者）带来的语言逻辑混淆，“氧化剂”实则是氧化别人，自己被还原，得电子。"
  }
]