[
  {
    "id": "chem_bond_physical_stick_10",
    "subject": "化学",
    "stage": [
      "h"
    ],
    "topic": "化学键",
    "name": "化学键是实体的连接棍",
    "description": "把化学键想象成连接原子的真实物理实体（像球棍模型里的棍子）。",
    "typical_error": "分子里的原子是用一根叫化学键的棍子连在一起的，发生反应就是把这根棍子掰断。",
    "cause": "直观教学教具（球棍模型）带来的视觉定势，未深入理解化学键本质上是一种静电作用力。"
  },
  {
    "id": "chem_reaction_complete_13",
    "subject": "化学",
    "stage": [
      "h"
    ],
    "topic": "化学平衡",
    "name": "可逆反应可以进行到底",
    "description": "认为只要反应时间足够长，或者反应物足够多，可逆反应中的反应物最终会100%转化为生成物。",
    "typical_error": "把 1mol N2 和 3mol H2 放在密闭容器里反应，最后一定能得到 2mol 的 NH3。",
    "cause": "受初中阶段完全反应的定势影响，未能建立起动态可逆平衡的观念。"
  },
  {
    "id": "chem_equilibrium_static_14",
    "subject": "化学",
    "stage": [
      "h"
    ],
    "topic": "化学平衡",
    "name": "化学平衡是静态停止的",
    "description": "认为反应达到平衡后，正逆反应都完全停止了，分子的运动也随之停止。",
    "typical_error": "反应达到平衡了，说明反应锅里的物质都不再发生任何化学变化了。",
    "cause": "宏观上的“不再改变”掩盖了微观上“正逆反应速率相等且不为零”的动态本质。"
  },
  {
    "id": "chem_gas_volume_15",
    "subject": "化学",
    "stage": [
      "h"
    ],
    "topic": "气体摩尔体积",
    "name": "气体摩尔体积永远是 22.4 L/mol",
    "description": "不管温度和压强条件如何，一律认为 1mol 气体的体积就是 22.4L。",
    "typical_error": "在常温常压下，1摩尔氧气的体积也是 22.4 升。",
    "cause": "死记硬背“标准状况”下的特殊值，忽略了温度和压强这两个决定气体体积的核心变量。"
  },
  {
    "id": "chem_organic_isomer_16",
    "subject": "化学",
    "stage": [
      "h"
    ],
    "topic": "有机化学基础",
    "name": "同分异构体物理性质相同",
    "description": "认为既然分子式相同，那它们的熔沸点、密度等物理性质也应该完全一样。",
    "typical_error": "正戊烷和新戊烷分子式都是 C5H12，所以它们的沸点肯定一样。",
    "cause": "没有理解分子结构（如支链的多少）对分子间作用力的影响，进而不理解结构决定性质。"
  },
  {
    "id": "chem_electron_shell_18",
    "subject": "化学",
    "stage": [
      "h"
    ],
    "topic": "原子结构",
    "name": "电子做经典的行星轨道运动",
    "description": "把玻尔模型中的电子轨道当作真实的物理轨道，认为电子像地球绕太阳一样做确定的圆周运动。",
    "typical_error": "电子就是在原子核外面一条条固定的圆圈轨道上跑的，我可以准确知道它下一秒在哪里。",
    "cause": "经典力学的决定论思维，无法适应量子力学中“电子云”和“概率分布”的反直觉概念。"
  },
  {
    "id": "chem_reaction_rate_20",
    "subject": "化学",
    "stage": [
      "h"
    ],
    "topic": "化学反应速率",
    "name": "增加固体质量会加快反应速率",
    "description": "认为在涉及固体的反应中，只要多加一点固体，反应就会变得更快。",
    "typical_error": "碳和氧气反应，我多加了一块煤，反应速率肯定加快了。",
    "cause": "混淆了“物质的量/浓度”与“质量”的区别，纯固体的浓度是常数，只有改变接触面积才能改变速率。"
  },
  {
    "id": "chem_hydrolysis_complete_21",
    "subject": "化学",
    "stage": [
      "h"
    ],
    "topic": "水解反应",
    "name": "盐类水解是彻底的进行到底的",
    "description": "写水解方程式时用等号，认为弱离子会全部水解生成弱电解质。",
    "typical_error": "氯化铁溶于水，所有的铁离子都变成了氢氧化铁沉淀，所以要画沉淀符号。",
    "cause": "未能把水解反应看作是微弱的、可逆的平衡过程，与完全的复分解反应混为一谈。"
  },
  {
    "id": "chem_galvanic_cell_22",
    "subject": "化学",
    "stage": [
      "h"
    ],
    "topic": "电化学",
    "name": "原电池中电子经过溶液",
    "description": "认为电子不仅在导线中流动，还会直接穿过电解质溶液跑到另一个电极上。",
    "typical_error": "电子从锌片出发，穿过稀硫酸溶液，游到了铜片上。",
    "cause": "未建立起“外电路电子导电、内电路离子导电”的完整闭合回路电荷转移模型。"
  },
  {
    "id": "chem_boiling_point_23",
    "subject": "化学",
    "stage": [
      "h"
    ],
    "topic": "分子间作用力",
    "name": "相对分子质量大沸点就绝对高",
    "description": "在比较氢化物沸点时，单纯依靠相对分子质量大小排序，忽略了氢键的特殊存在。",
    "typical_error": "硫化氢的相对分子质量比水大，所以硫化氢的沸点肯定比水高。",
    "cause": "范德华力规律的机械套用，对氢键的反常影响（如水、氨气、氟化氢的沸点异常）认知盲区。"
  },
  {
    "id": "chem_bond_ionic_24",
    "subject": "化学",
    "stage": [
      "h"
    ],
    "topic": "化学键",
    "name": "金属与非金属只形成离子键",
    "description": "只要看到是由金属元素和非金属元素组成的化合物，就断定它一定是离子化合物。",
    "typical_error": "氯化铝（AlCl3）里有铝这个金属，所以它绝对是离子化合物。",
    "cause": "过度依赖初中的元素分类直觉，不理解化学键类型取决于电负性差值（AlCl3 实为共价化合物）。"
  },
  {
    "id": "chem_oxidation_state_25",
    "subject": "化学",
    "stage": [
      "h"
    ],
    "topic": "化合价",
    "name": "所有元素最高价等于族序数",
    "description": "认为周期表中所有主族元素的最高正化合价都绝对等于它的族序数，忽略了氟和氧的特例。",
    "typical_error": "氟元素在第七主族，所以它的最高正化合价肯定是 +7 价。",
    "cause": "盲目记忆周期律的一般规律，未能理解氟的电负性最大，没有正价态。"
  },
  {
    "id": "chem_buffer_solution_26",
    "subject": "化学",
    "stage": [
      "h"
    ],
    "topic": "溶液平衡",
    "name": "缓冲溶液能抵御无尽的酸碱",
    "description": "认为缓冲溶液无论加入多少酸或碱，其 pH 值都能永远保持不变。",
    "typical_error": "既然这是缓冲溶液，那我倒一整瓶浓盐酸进去，它的酸碱度也不会变。",
    "cause": "对“缓冲容量”有限性缺乏认识，把抵抗酸碱干扰的相对能力绝对化。"
  },
  {
    "id": "chem_indicator_color_27",
    "subject": "化学",
    "stage": [
      "h"
    ],
    "topic": "酸碱滴定",
    "name": "指示剂变色点正好是 pH=7",
    "description": "认为所有酸碱指示剂（如甲基橙、酚酞）的变色范围都严格围绕着中性点 pH=7 展开。",
    "typical_error": "酚酞变色了，说明溶液现在刚好是中性，pH 刚好等于 7。",
    "cause": "把石蕊试纸的粗略中性变色点泛化到了所有高精度滴定指示剂上，忽略了它们的特定变色区间。"
  },
  {
    "id": "chem_le_chatelier_28",
    "subject": "化学",
    "stage": [
      "h"
    ],
    "topic": "勒夏特列原理",
    "name": "平衡正向移动必导致转化率增大",
    "description": "增加一种反应物的浓度，平衡向正向移动，就认为所有反应物的转化率都增大了（包括被增加的反应物自身）。",
    "typical_error": "多加点氮气，平衡往右移，所以氮气的转化率也提高了。",
    "cause": "逻辑推导存在断层，未考虑到增加量往往远大于因为平衡移动而额外消耗的量，导致自身转化率反而下降。"
  },
  {
    "id": "chem_precipitation_29",
    "subject": "化学",
    "stage": [
      "h"
    ],
    "topic": "沉淀溶解平衡",
    "name": "Ksp 小的物质一定先沉淀",
    "description": "在分步沉淀中，单纯依靠溶度积 (Ksp) 的大小来判断沉淀顺序，忽略了反应物离子浓度的影响或化学式类型的差异。",
    "typical_error": "看表格发现物质 A 的 Ksp 比物质 B 小，就断定滴加试剂时 A 绝对先沉淀出来。",
    "cause": "对溶度积常数应用条件的片面理解，没有通过计算离子积 (Qc) 进行严谨比较。"
  },
  {
    "id": "chem_particle_molecule_01_alt_high",
    "subject": "化学",
    "stage": [
      "h"
    ],
    "topic": "物质构成的奥秘",
    "name": "原子是不可再分的最小微粒",
    "description": "认为原子是实心球体，内部没有更小的结构。",
    "typical_error": "原子是构成物质的最小微粒，不能再切分了。",
    "cause": "对道尔顿原子学说的局限性认识不足，未掌握原子内部结构。"
  },
  {
    "id": "chem_mass_conservation_03_alt_high",
    "subject": "化学",
    "stage": [
      "h"
    ],
    "topic": "质量守恒定律",
    "name": "气体生成不算在质量守恒内",
    "description": "认为反应中生成的气体跑掉了，所以反应前后质量不守恒。",
    "typical_error": "木炭燃烧后只剩下一点灰，不符合质量守恒。",
    "cause": "只关注固体或液体的质量，忽视了气体的参与和生成。"
  },
  {
    "id": "chem_acid_base_structure_05_alt_high",
    "subject": "化学",
    "stage": [
      "h"
    ],
    "topic": "酸和碱",
    "name": "所有含氢元素的化合物都是酸",
    "description": "认为分子中含有H原子的物质都具有酸性。",
    "typical_error": "甲烷(CH4)里有四个氢，它是一种酸。",
    "cause": "对酸的定义（电离时产生的阳离子全部是氢离子）理解片面。"
  },
  {
    "id": "chem_ion_charge_create_07_alt_high",
    "subject": "化学",
    "stage": [
      "h"
    ],
    "topic": "离子与核外电子",
    "name": "离子带电是因为产生了新电荷",
    "description": "认为离子之所以带电，是因为反应中凭空创造了正负电荷。",
    "typical_error": "钠原子变成钠离子是因为它产生了一个正电荷。",
    "cause": "不理解得失电子导致质子和电子数量不平衡的微观机制。"
  },
  {
    "id": "chem_metal_activity_08_alt_high",
    "subject": "化学",
    "stage": [
      "h"
    ],
    "topic": "金属活动性",
    "name": "所有金属都能与酸反应生成氢气",
    "description": "认为金属活动性顺序表中的所有金属都能和稀酸反应。",
    "typical_error": "铜放在稀盐酸里也会慢慢冒出气泡。",
    "cause": "忽视了氢元素在金属活动性顺序表中的分界线作用。"
  },
  {
    "id": "chem_oxidation_oxygen_11_alt_high",
    "subject": "化学",
    "stage": [
      "h"
    ],
    "topic": "氧化还原反应",
    "name": "燃烧一定会产生火焰",
    "description": "认为所有剧烈的发光发热的氧化反应都会有火焰伴随。",
    "typical_error": "铁丝在氧气中燃烧会有明亮的蓝色火焰。",
    "cause": "对火焰产生的条件（气体燃烧）不清楚，将发光与火焰混淆。"
  },
  {
    "id": "chem_ph_scale_17_alt_high",
    "subject": "化学",
    "stage": [
      "h"
    ],
    "topic": "溶液的酸碱性",
    "name": "pH试纸可以直接测定气体的pH值",
    "description": "认为干燥的pH试纸可以直接用来测定气体的酸碱性。",
    "typical_error": "把干燥的pH试纸伸入氯化氢气体中测pH。",
    "cause": "忘记了测气体需要先将试纸润湿，或者气体只有溶于水才显酸碱性。"
  },
  {
    "id": "chem_salt_neutral_19_alt_high",
    "subject": "化学",
    "stage": [
      "h"
    ],
    "topic": "盐类水解",
    "name": "所有盐都易溶于水",
    "description": "认为只要是被称为“盐”的化合物，都能在水中溶解。",
    "typical_error": "碳酸钙是盐，所以它可以溶于水配置溶液。",
    "cause": "将生活中的食盐（氯化钠）的性质过度泛化。"
  },
  {
    "id": "chem_redox_electron_30_alt_high",
    "subject": "化学",
    "stage": [
      "h"
    ],
    "topic": "氧化还原反应",
    "name": "氧化剂在反应中被氧化",
    "description": "从字面意思推断，认为氧化剂自身发生的反应是氧化反应。",
    "typical_error": "氧化剂顾名思义就是被氧化的物质。",
    "cause": "混淆了反应物角色与发生反应类型的关系（氧化剂得电子，发生还原反应）。"
  }
]