[
  {
    "id": "chi_rhetoric_metaphor_08",
    "subject": "语文",
    "stage": [
      "p_upper"
    ],
    "topic": "修辞手法",
    "name": "把表示猜测或想象的词误认为比喻",
    "description": "只要看到句子中有“像”、“仿佛”等词，就断定该句运用了比喻的修辞手法。",
    "typical_error": "“他长得真像他爸爸。”或者“天阴沉沉的，仿佛要下雨了。”这两句都被判断为比喻句。",
    "cause": "对修辞手法的判断停留在表面的“标志词”抓取，没有触及比喻的本质要求：本体和喻体必须是不同类的事物。"
  },
  {
    "id": "chi_writing_style_13",
    "subject": "语文",
    "stage": [
      "p_upper"
    ],
    "topic": "写作表达",
    "name": "记叙文流水账缺乏详略",
    "description": "在写记叙文时，按照时间顺序把一天发生的所有事情平均用力地罗列出来，没有高潮和重点细节。",
    "typical_error": "写《难忘的一天》，用一半篇幅写早上怎么起床刷牙吃饭坐车，到了关键事件只用几句话带过。",
    "cause": "叙事剪裁能力不足，未能围绕“中心思想”或“主题”来选择和放大重点素材。"
  },
  {
    "id": "chi_character_form_25",
    "subject": "语文",
    "stage": [
      "p_upper"
    ],
    "topic": "汉字书写与辨析",
    "name": "形近字与音近字混淆",
    "description": "无法区分字形相近或读音相同的汉字，经常写错别字，尤其是在成语书写中。",
    "typical_error": "把“拆卸”写成“折卸”，或者把“迫不及待”写成“迫不急待”。",
    "cause": "在认字阶段没有建立起形旁表意、声旁表音的汉字造字法结构认知，只是机械记忆图形轮廓。"
  },
  {
    "id": "chi_rhetoric_hyperbole_28",
    "subject": "语文",
    "stage": [
      "p_upper"
    ],
    "topic": "修辞手法",
    "name": "将夸张视为不符合事实的谎言",
    "description": "基于儿童直观现实的认知，对文学作品中的夸张手法产生抵触，认为它不符合科学常理或是在说谎。",
    "typical_error": "读到李白的“白发三千丈”，觉得李白在骗人，人的头发不可能长到三千丈那么长。",
    "cause": "具体运算阶段的儿童认知受限于眼见为实的具象世界，尚不能完全进入文学浪漫主义的夸张想象空间。"
  }
]