[
  {
    "id": "politics_rights_01",
    "subject": "politics",
    "stage": [
      "j_lower"
    ],
    "topic": "权利与义务",
    "name": "权利与义务可割裂",
    "description": "认为可以只享受权利而不履行义务，或者认为先享有权利然后才需要履行义务。",
    "typical_error": "既然我有言论自由的权利，那我在网上想骂谁就骂谁，别人管不着。",
    "cause": "没有理解权利与义务的一致性和统一性，将两者割裂开来，过度强调自我权利而忽视社会责任。"
  },
  {
    "id": "politics_law_01",
    "subject": "politics",
    "stage": [
      "j_upper"
    ],
    "topic": "法律的作用",
    "name": "法律仅用于惩罚",
    "description": "认为法律存在的唯一目的和作用就是制裁犯罪，忽视了法律的规范作用和保护作用。",
    "typical_error": "我觉得只要我不犯法，法律就跟我没有任何关系。",
    "cause": "对法律功能的认知过于片面，只注意到了刑法等具有强烈惩罚色彩的法律规范，忽略了民法等保护公民权益的日常法律。"
  },
  {
    "id": "politics_constitution_01",
    "subject": "politics",
    "stage": [
      "j_lower"
    ],
    "topic": "宪法",
    "name": "宪法等同于普通法律",
    "description": "认为宪法和刑法、民法等普通法律在法律体系中的地位、效力是一样的。",
    "typical_error": "宪法也就是法律的一种，和未成年人保护法没什么级别上的区别吧。",
    "cause": "没有掌握宪法是国家的根本大法、具有最高法律效力的特征，缺乏对法律位阶的认识。"
  },
  {
    "id": "politics_fairness_01",
    "subject": "politics",
    "stage": [
      "j_upper"
    ],
    "topic": "公平正义",
    "name": "公平等于绝对平均",
    "description": "将社会公平简单等同于财富、分配上的绝对平均。",
    "typical_error": "既然社会要公平，那就应该把有钱人的钱分给大家，让所有人的钱一样多。",
    "cause": "混淆了机会公平、规则公平与结果绝对平均的区别，陷入了平均主义的误区。"
  },
  {
    "id": "politics_privacy_01",
    "subject": "politics",
    "stage": [
      "j_lower"
    ],
    "topic": "隐私权",
    "name": "未成年人无隐私权",
    "description": "认为未成年人没有独立的隐私权，家长可以随意翻看日记、聊天记录。",
    "typical_error": "我是未成年人，我爸妈看我的微信聊天记录是为了我好，这是他们的权利。",
    "cause": "对法律主体的认知存在偏差，没有认识到未成年人作为独立的个体，同样享有受法律保护的隐私权。"
  },
  {
    "id": "politics_network_01",
    "subject": "politics",
    "stage": [
      "j_upper"
    ],
    "topic": "网络交往",
    "name": "网络是法外之地",
    "description": "认为网络世界是完全虚拟的，在网上做什么都不受现实法律和道德的约束。",
    "typical_error": "反正网上谁也不认识谁，我造个谣发泄一下也不会有人抓我。",
    "cause": "未能理解网络空间也是公共空间的一部分，现实中的法律和道德规范同样适用于网络世界。"
  },
  {
    "id": "politics_culture_01",
    "subject": "politics",
    "stage": [
      "j_lower"
    ],
    "topic": "文化传承与交流",
    "name": "外来文化都是糟粕",
    "description": "对外来文化持完全否定的态度，认为应当全部抵制以保护传统文化。",
    "typical_error": "我们应该只过春节不过圣诞节，彻底禁止所有外国电影在我国上映。",
    "cause": "缺乏文化包容性和批判性思维，不能用“取其精华、去其糟粕”的辩证眼光看待外来文化。"
  },
  {
    "id": "politics_nation_01",
    "subject": "politics",
    "stage": [
      "j_upper"
    ],
    "topic": "国家利益",
    "name": "维护国家利益必牺牲个人利益",
    "description": "认为国家利益和个人利益是完全对立的，维护国家利益就必须无条件牺牲一切个人利益。",
    "typical_error": "为了国家利益，个人就不能去追求自己的幸福和利益了。",
    "cause": "没有理解在我国国家利益和个人利益在根本上是一致的，二者相辅相成，并非简单的零和博弈。"
  },
  {
    "id": "politics_democracy_01",
    "subject": "politics",
    "stage": [
      "j_lower"
    ],
    "topic": "民主选举",
    "name": "所有代表均为直接选举",
    "description": "认为各级人民代表大会的代表都是由选民直接投票选举产生的。",
    "typical_error": "全国人大代表也是我们普通老百姓一人一票直接选出来的。",
    "cause": "对我国的选举制度不够了解，没有区分直接选举（县乡级）和间接选举（全国、省级、设区的市级）。"
  },
  {
    "id": "politics_emotion_01",
    "subject": "politics",
    "stage": [
      "j_upper"
    ],
    "topic": "青春期心理",
    "name": "青春期冲动皆为异常",
    "description": "将青春期正常的心理波动、闭锁心理或对异性的好感视为病态或严重错误。",
    "typical_error": "我最近总是莫名其妙地烦躁，还不想和父母说话，我是不是心理有严重问题了？",
    "cause": "缺乏基本的青春期生理和心理健康知识，不能客观看待和接纳自己成长过程中的正常变化。"
  }
]