[
  {
    "id": "geo_earth_03",
    "subject": "geography",
    "stage": [
      "h"
    ],
    "topic": "区时与日界线",
    "name": "向东跨日界线加一天",
    "description": "在进行日期计算时，错误地认为自西向东跨越国际日期变更线时，日期应该加一天。",
    "typical_error": "从东12区向东跨过国际日期变更线进入西12区，时间虽然不变，但日期要往后加一天。",
    "cause": "受“向东时区时间早、要加小时数”的惯性思维影响。实际上，东12区是全球最早的一天，向东进入西12区（最晚）日期应减去一天。"
  },
  {
    "id": "geo_ocean_01",
    "subject": "geography",
    "stage": [
      "h"
    ],
    "topic": "洋流",
    "name": "寒流必从高纬流向低纬",
    "description": "认为所有被称为“寒流”的洋流，其流向必定是从高纬度流向低纬度的。",
    "typical_error": "索马里寒流是寒流，所以它一定是从南极或北极方向高纬度流过来的。",
    "cause": "将一般规律（多数寒流是从高纬流向低纬）绝对化。忽略了索马里寒流等补偿流，它是受西南季风吹拂形成的离岸流引起底层冷海水上泛而成的寒流，流向是由低纬向高纬。"
  },
  {
    "id": "geo_atmosphere_01",
    "subject": "geography",
    "stage": [
      "h"
    ],
    "topic": "气压带风带",
    "name": "赤道低气压带为动力成因",
    "description": "认为赤道低气压带和副热带高气压带一样，都是由空气动力学原因形成的。",
    "typical_error": "赤道地区空气是被迫抬升的，所以形成了动力成因的赤道低气压带。",
    "cause": "混淆了热力成因和动力成因。赤道低气压带和极地高气压带是由于气温高/低引起气流膨胀上升/收缩下沉形成的，属于热力成因。"
  },
  {
    "id": "geo_atmosphere_02",
    "subject": "geography",
    "stage": [
      "h"
    ],
    "topic": "常见天气系统",
    "name": "冷锋降水在锋前",
    "description": "错误记忆锋面降水的位置，认为冷锋的降雨区主要分布在锋线的锋前位置。",
    "typical_error": "冷空气马上就要推过来了，现在这片位于冷锋锋前的地方很快就会下大暴雨。",
    "cause": "记忆混淆。一般规律是“冷锋降水主要在锋后，暖锋降水主要在锋前”。"
  },
  {
    "id": "geo_human_01",
    "subject": "geography",
    "stage": [
      "h"
    ],
    "topic": "农业区位",
    "name": "混淆主导因素与限制性因素",
    "description": "在分析农业区位时，分不清使得该地能够发展某种农业的“主导因素”和制约其发展的“限制性因素”。",
    "typical_error": "新疆之所以能大面积种植优质棉花，其限制性因素是光照充足。",
    "cause": "概念理解不透彻。光照充足是新疆种植棉花的优势/主导因素，而水分（水资源缺乏）才是当地农业发展的限制性因素。"
  },
  {
    "id": "geo_human_02",
    "subject": "geography",
    "stage": [
      "h"
    ],
    "topic": "工业区位",
    "name": "高新技术产业看重劳动力数量",
    "description": "认为芯片制造、航空航天等高新技术产业选址时主要考虑当地是否有大量廉价的劳动力。",
    "typical_error": "某跨国公司把芯片研发中心建在印度某小镇，主要是因为那里劳动力数量多且便宜。",
    "cause": "未区分劳动密集型产业和技术密集型产业的区位需求。高新技术产业的主导因素是科学技术（人才素质），而非劳动力数量。"
  },
  {
    "id": "geo_human_03",
    "subject": "geography",
    "stage": [
      "h"
    ],
    "topic": "城市化",
    "name": "城市化水平越高速度越快",
    "description": "认为发达国家的城市化水平高，因此他们现在的城市化速度一定比发展中国家快。",
    "typical_error": "英国城市化水平超过了80%，所以现在英国每年有大量农村人口涌入城市，城市化速度极快。",
    "cause": "不理解城市化发展的S型曲线规律。发达国家城市化处于后期成熟阶段，水平高但速度已明显减缓甚至出现逆城市化；发展中国家多处于中期加速阶段，水平较低但速度快。"
  },
  {
    "id": "geo_environment_01",
    "subject": "geography",
    "stage": [
      "h"
    ],
    "topic": "自然环境的地域差异",
    "name": "经度地带性与热量无关",
    "description": "认为由沿海向内陆的地域分异规律（经度地带性）完完全全只受水分条件影响，和热量没有一点关系。",
    "typical_error": "从中纬度欧亚大陆东岸走到内陆，植被从森林变成荒漠，这纯粹是因为降水变少，和温度热量毫无关联。",
    "cause": "对地理规律的理解过于绝对化。虽说水分是主导因素，但这往往是在同一温度带（一定热量基础）下发生的，不能说完全无关。"
  },
  {
    "id": "geo_geology_02",
    "subject": "geography",
    "stage": [
      "h"
    ],
    "topic": "地质构造与地貌",
    "name": "背斜成谷是因岩层软弱",
    "description": "解释地形倒置现象时，认为背斜顶部变成谷地是因为它本身是由软弱岩层构成的。",
    "typical_error": "背斜之所以后来会变成山谷，是因为背斜中心的岩石天生就比较松软，容易被风化。",
    "cause": "未从受力角度分析。背斜顶部受张力作用，岩层裂隙发育，岩石破碎，才更容易被外力侵蚀成谷地，并非原岩层本身属性差异。"
  },
  {
    "id": "geo_environment_02",
    "subject": "geography",
    "stage": [
      "h"
    ],
    "topic": "全球气候变化",
    "name": "全球变暖导致所有地区减产",
    "description": "片面认为全球气候变暖带来的影响全都是负面的，会导致全球所有国家和地区的农业都严重减产。",
    "typical_error": "全球变暖会导致全世界的农作物大面积枯死，连俄罗斯和加拿大的小麦都会绝收。",
    "cause": "缺乏辩证和区域差异的视角。全球变暖会使中低纬度地区因蒸发加剧而干旱减产，但部分高纬度地区（如俄罗斯）可能因气温升高、积温增加而使得农业增产。"
  }
]