[
  {
    "id": "geo_earth_01",
    "subject": "地理",
    "stage": [
      "j_lower"
    ],
    "topic": "经纬网",
    "name": "经线互相平行",
    "description": "认为所有的经线就像纬线一样，彼此之间是互相平行的。",
    "typical_error": "因为赤道上的经线间距很大，所以经线和纬线一样，永远都不会相交。",
    "cause": "将平面直角坐标系的直线概念错误地迁移到了球面几何上，未认识到所有经线都会在南、北两极点相交。"
  },
  {
    "id": "geo_earth_02",
    "subject": "地理",
    "stage": [
      "j_upper"
    ],
    "topic": "地球公转",
    "name": "距离太阳远近导致四季",
    "description": "认为地球上四季交替的原因是地球在椭圆轨道上运行，离太阳近时是夏天，离太阳远时是冬天。",
    "typical_error": "北半球夏天之所以热，是因为这个时候地球公转到了离太阳最近的地方。",
    "cause": "凭直觉推断，忽略了地球公转时地轴是倾斜的（黄赤交角）。实际上北半球夏至时地球正处于远日点附近，太阳直射点位置才是决定四季的根本原因。"
  },
  {
    "id": "geo_map_01",
    "subject": "地理",
    "stage": [
      "j_lower"
    ],
    "topic": "等高线地形图",
    "name": "等高线密集坡度缓",
    "description": "认为等高线排布越密集的地方，实际的地形坡度越平缓。",
    "typical_error": "这边的等高线画得密密麻麻的，说明这里地势很平缓，适合修建公路。",
    "cause": "对等高线原理缺乏空间想象力。同一幅图中，等高距相同，等高线越密集代表水平距离内高差越大，因此坡度越陡。"
  },
  {
    "id": "geo_map_02",
    "subject": "地理",
    "stage": [
      "j_upper"
    ],
    "topic": "比例尺",
    "name": "比例尺大范围大",
    "description": "在图幅大小相同的情况下，认为比例尺越大的地图，表示的实际地理范围也越大。",
    "typical_error": "为了在一张纸上画下整个世界，我们需要使用一个非常大的比例尺。",
    "cause": "比例尺是分式（如 1/1000），分母越小比例尺越大。图幅相同，比例尺越大，表示的范围越小，内容越详细。"
  },
  {
    "id": "geo_climate_01",
    "subject": "地理",
    "stage": [
      "j_lower"
    ],
    "topic": "天气与气候",
    "name": "混淆天气与气候",
    "description": "在日常用语和地理描述中，无法正确区分“天气”和“气候”的区别。",
    "typical_error": "我们北京今天的气候真不错，晴空万里，也没有风。",
    "cause": "未掌握两者的核心区别：天气指短时间、多变的大气状况；气候指长时间、稳定的大气平均状况。"
  },
  {
    "id": "geo_climate_02",
    "subject": "地理",
    "stage": [
      "j_upper"
    ],
    "topic": "气候类型",
    "name": "热带雨林与季风气候等同",
    "description": "认为热带雨林气候和热带季风气候都是热带多雨气候，没有区别。",
    "typical_error": "东南亚和巴西亚马孙平原的气候是一样的，反正都是一年到头又热又下雨。",
    "cause": "只关注了“热带”“多雨”的共性，忽略了热带季风气候有明显的旱雨两季交替，而热带雨林气候是全年多雨。"
  },
  {
    "id": "geo_world_01",
    "subject": "地理",
    "stage": [
      "j_lower"
    ],
    "topic": "亚洲地势",
    "name": "亚洲中间低四周高",
    "description": "把亚洲的地势特征记反，认为是“盆地”状的中间低、四周高。",
    "typical_error": "亚洲的地形就像一个大碗，中间凹陷，四周高高隆起，河流都往中间流。",
    "cause": "记忆混淆或缺乏对亚洲地形图的整体感知。亚洲地势实为“中部高、四周低”，河流多呈放射状流向周边海洋。"
  },
  {
    "id": "geo_climate_03",
    "subject": "地理",
    "stage": [
      "j_upper"
    ],
    "topic": "世界降水分布",
    "name": "两极降水多",
    "description": "认为两极地区全被冰雪覆盖，是因为当地常年下大雪，降水极其丰富。",
    "typical_error": "南极到处都是厚厚的冰川，那里的降水量一定是全世界最多的。",
    "cause": "被地表积雪现象误导。两极地区受极地高气压带控制，空气下沉，降水稀少（被称为白色沙漠），冰川是因为极寒气温导致雪不融化而累积形成的。"
  },
  {
    "id": "geo_geology_01",
    "subject": "地理",
    "stage": [
      "j_lower"
    ],
    "topic": "板块构造学说",
    "name": "地震多发于板块内部",
    "description": "认为火山和地震主要发生在一个大板块的中心内部区域。",
    "typical_error": "为了安全，日本应该把城市建在亚欧板块的最中心位置，因为那里地震最多。",
    "cause": "违背了板块构造学说的基本观点：板块内部地壳比较稳定，板块与板块交界的地带地壳比较活跃，多火山地震。"
  },
  {
    "id": "geo_population_01",
    "subject": "地理",
    "stage": [
      "j_upper"
    ],
    "topic": "世界人口",
    "name": "世界人口分布均匀",
    "description": "认为人类在地球上各个大陆、各个纬度的分布是相对平均的。",
    "typical_error": "地球上有70多亿人，所以不管是撒哈拉沙漠还是西欧平原，人口密度应该差不多。",
    "cause": "缺乏对自然环境限制人类活动的主观认知。受气候、地形、水源等影响，世界人口分布极度不均（多集中在中低纬度沿海平原）。"
  }
]
